{
  "schema_version": "3.5.0",
  "run_id": "kafka-cpu_light-20260322_162717-f016759e",
  "suite_id": "kafka_partition_adequacy",
  "condition_id": "partitions=2",
  "repeat_index": 1,
  "variable_under_test": "partitions",
  "system": "kafka",
  "workload": "cpu_light",
  "timestamp": "2026-03-22T16:28:01.536791+00:00",
  "run_start_utc": "2026-03-22T16:28:00.008605Z",
  "run_end_utc": "2026-03-22T16:28:01.291576Z",
  "config": {
    "messages": 5000,
    "warmup": 500,
    "produce_pattern": "sequential",
    "stub_delay_ms": 0,
    "stub_capacity_workers": 20,
    "nominal_concurrency_target": 4,
    "semantics_profile": "acks=all, single-replica topic, partition-ordered consumption",
    "burst_size": null,
    "inter_burst_ms": null,
    "delay_seconds": null,
    "concurrency_model": "consumer_instances",
    "requested_partitions": 2,
    "observed_partitions": 2,
    "kafka_consumer_replicas": 4,
    "kafka_consumer_instances_per_container": 1,
    "kafka_configured_consumer_instances": 4,
    "kafka_assignment_parallelism_upper_bound": 2,
    "kafka_compression": "none",
    "kafka_acks": "all"
  },
  "statistics": {
    "expected_messages": 5000,
    "accounted_messages": 5000,
    "total_messages": 5000,
    "successful": 5000,
    "logical_failures": 0,
    "exception_failures": 0,
    "failed": 0,
    "error_rate_pct": 0.0,
    "latency_ms": {
      "min": 7.57,
      "max": 1164.87,
      "mean": 588.54,
      "median": 588.71,
      "p95": 1106.16,
      "p99": 1152.3,
      "stddev": 330.53
    },
    "wait_to_start_ms": {
      "min": 6.87,
      "max": 1164.51,
      "mean": 588.17,
      "median": 588.34,
      "p95": 1105.8,
      "p99": 1151.95,
      "stddev": 330.53
    },
    "processing_ms": {
      "min": 0.34,
      "max": 0.71,
      "mean": 0.37,
      "median": 0.37,
      "p95": 0.39,
      "p99": 0.48
    },
    "throughput": {
      "consumed_msg_per_sec": 4199.68,
      "produce_msg_per_sec": 181340.8
    },
    "timing_s": {
      "total_wall": 1.1906,
      "produce": 0.0276,
      "drain": 1.163
    }
  },
  "trace_file": "traces/kafka-cpu_light-20260322_162717-f016759e.jsonl.gz",
  "resource_usage": {
    "samples": 2,
    "by_role": {
      "kafka_consumer": {
        "cpu_pct": {
          "mean": 0.22,
          "peak": 0.22
        },
        "mem_mb": {
          "mean": 109.08,
          "peak": 109.08
        }
      },
      "kafka_broker": {
        "cpu_pct": {
          "mean": 2.19,
          "peak": 2.29
        },
        "mem_mb": {
          "mean": 545.55,
          "peak": 588.6
        }
      }
    }
  }
}
