[
  {
    "schema_version": "3.5.0",
    "run_id": "sidekiq-io_bound-20260322_171916-e39a60cd",
    "suite_id": "io_bound_matched_concurrency",
    "condition_id": "concurrency=4",
    "repeat_index": 1,
    "variable_under_test": "system",
    "system": "sidekiq",
    "workload": "io_bound",
    "timestamp": "2026-03-22T17:19:54.695739+00:00",
    "run_start_utc": "2026-03-22T17:19:24.398909Z",
    "run_end_utc": "2026-03-22T17:19:54.537375Z",
    "config": {
      "messages": 2000,
      "warmup": 500,
      "produce_pattern": "sequential",
      "stub_delay_ms": 50,
      "stub_capacity_workers": 20,
      "nominal_concurrency_target": 4,
      "semantics_profile": "retry=false, Redis queue, worker-thread execution",
      "burst_size": null,
      "inter_burst_ms": null,
      "delay_seconds": null,
      "concurrency_model": "processor_slots",
      "sidekiq_worker_replicas": 1,
      "sidekiq_threads_per_worker": 4,
      "sidekiq_configured_processor_slots": 4,
      "sidekiq_processor_parallelism_upper_bound": 4
    },
    "statistics": {
      "expected_messages": 2000,
      "accounted_messages": 2000,
      "total_messages": 2000,
      "successful": 2000,
      "logical_failures": 0,
      "exception_failures": 0,
      "failed": 0,
      "error_rate_pct": 0.0,
      "latency_ms": {
        "min": 59.05,
        "max": 29812.12,
        "mean": 14869.14,
        "median": 14843.9,
        "p95": 28291.34,
        "p99": 29506.89,
        "stddev": 8629.91
      },
      "wait_to_start_ms": {
        "min": 1.47,
        "max": 29757.19,
        "mean": 14813.37,
        "median": 14787.99,
        "p95": 28236.07,
        "p99": 29451.46,
        "stddev": 8629.71
      },
      "processing_ms": {
        "min": 50.99,
        "max": 72.02,
        "mean": 55.77,
        "median": 55.58,
        "p95": 59.66,
        "p99": 61.26
      },
      "throughput": {
        "consumed_msg_per_sec": 66.72,
        "produce_msg_per_sec": 11791.61
      },
      "timing_s": {
        "total_wall": 29.9779,
        "produce": 0.1696,
        "drain": 29.812
      }
    },
    "trace_file": "traces/sidekiq-io_bound-20260322_171916-e39a60cd.jsonl.gz"
  },
  {
    "schema_version": "3.5.0",
    "run_id": "sidekiq-io_bound-20260322_171956-24edc348",
    "suite_id": "io_bound_matched_concurrency",
    "condition_id": "concurrency=4",
    "repeat_index": 2,
    "variable_under_test": "system",
    "system": "sidekiq",
    "workload": "io_bound",
    "timestamp": "2026-03-22T17:20:34.383445+00:00",
    "run_start_utc": "2026-03-22T17:20:03.841029Z",
    "run_end_utc": "2026-03-22T17:20:34.254795Z",
    "config": {
      "messages": 2000,
      "warmup": 500,
      "produce_pattern": "sequential",
      "stub_delay_ms": 50,
      "stub_capacity_workers": 20,
      "nominal_concurrency_target": 4,
      "semantics_profile": "retry=false, Redis queue, worker-thread execution",
      "burst_size": null,
      "inter_burst_ms": null,
      "delay_seconds": null,
      "concurrency_model": "processor_slots",
      "sidekiq_worker_replicas": 1,
      "sidekiq_threads_per_worker": 4,
      "sidekiq_configured_processor_slots": 4,
      "sidekiq_processor_parallelism_upper_bound": 4
    },
    "statistics": {
      "expected_messages": 2000,
      "accounted_messages": 2000,
      "total_messages": 2000,
      "successful": 2000,
      "logical_failures": 0,
      "exception_failures": 0,
      "failed": 0,
      "error_rate_pct": 0.0,
      "latency_ms": {
        "min": 56.42,
        "max": 30077.51,
        "mean": 14966.63,
        "median": 14936.97,
        "p95": 28549.32,
        "p99": 29763.1,
        "stddev": 8705.75
      },
      "wait_to_start_ms": {
        "min": 1.03,
        "max": 30017.06,
        "mean": 14910.4,
        "median": 14881.06,
        "p95": 28495.21,
        "p99": 29705.62,
        "stddev": 8705.3
      },
      "processing_ms": {
        "min": 50.98,
        "max": 70.01,
        "mean": 56.22,
        "median": 55.9,
        "p95": 60.88,
        "p99": 63.62
      },
      "throughput": {
        "consumed_msg_per_sec": 66.14,
        "produce_msg_per_sec": 12086.63
      },
      "timing_s": {
        "total_wall": 30.2403,
        "produce": 0.1655,
        "drain": 30.0772
      }
    },
    "trace_file": "traces/sidekiq-io_bound-20260322_171956-24edc348.jsonl.gz"
  },
  {
    "schema_version": "3.5.0",
    "run_id": "sidekiq-io_bound-20260322_172035-8ea5a03f",
    "suite_id": "io_bound_matched_concurrency",
    "condition_id": "concurrency=4",
    "repeat_index": 3,
    "variable_under_test": "system",
    "system": "sidekiq",
    "workload": "io_bound",
    "timestamp": "2026-03-22T17:21:14.076500+00:00",
    "run_start_utc": "2026-03-22T17:20:43.533681Z",
    "run_end_utc": "2026-03-22T17:21:13.945924Z",
    "config": {
      "messages": 2000,
      "warmup": 500,
      "produce_pattern": "sequential",
      "stub_delay_ms": 50,
      "stub_capacity_workers": 20,
      "nominal_concurrency_target": 4,
      "semantics_profile": "retry=false, Redis queue, worker-thread execution",
      "burst_size": null,
      "inter_burst_ms": null,
      "delay_seconds": null,
      "concurrency_model": "processor_slots",
      "sidekiq_worker_replicas": 1,
      "sidekiq_threads_per_worker": 4,
      "sidekiq_configured_processor_slots": 4,
      "sidekiq_processor_parallelism_upper_bound": 4
    },
    "statistics": {
      "expected_messages": 2000,
      "accounted_messages": 2000,
      "total_messages": 2000,
      "successful": 2000,
      "logical_failures": 0,
      "exception_failures": 0,
      "failed": 0,
      "error_rate_pct": 0.0,
      "latency_ms": {
        "min": 56.34,
        "max": 30167.06,
        "mean": 15055.93,
        "median": 15077.19,
        "p95": 28663.83,
        "p99": 29868.78,
        "stddev": 8750.87
      },
      "wait_to_start_ms": {
        "min": 1.1,
        "max": 30110.02,
        "mean": 14999.44,
        "median": 15021.91,
        "p95": 28610.06,
        "p99": 29812.78,
        "stddev": 8750.69
      },
      "processing_ms": {
        "min": 50.97,
        "max": 71.21,
        "mean": 56.49,
        "median": 56.09,
        "p95": 61.63,
        "p99": 65.04
      },
      "throughput": {
        "consumed_msg_per_sec": 65.93,
        "produce_msg_per_sec": 11560.62
      },
      "timing_s": {
        "total_wall": 30.3368,
        "produce": 0.173,
        "drain": 30.1667
      }
    },
    "trace_file": "traces/sidekiq-io_bound-20260322_172035-8ea5a03f.jsonl.gz"
  }
]
