[
  {
    "schema_version": "3.5.0",
    "run_id": "kafka-cpu_light-20260322_165150-04eb7f90",
    "suite_id": "cpu_light_matched_concurrency",
    "condition_id": "concurrency=4",
    "repeat_index": 1,
    "variable_under_test": "system",
    "system": "kafka",
    "workload": "cpu_light",
    "timestamp": "2026-03-22T16:52:03.108753+00:00",
    "run_start_utc": "2026-03-22T16:51:58.023380Z",
    "run_end_utc": "2026-03-22T16:52:02.589949Z",
    "config": {
      "messages": 10000,
      "warmup": 500,
      "produce_pattern": "sequential",
      "stub_delay_ms": 0,
      "stub_capacity_workers": 20,
      "nominal_concurrency_target": 4,
      "semantics_profile": "acks=all, single-replica topic, partition-ordered consumption",
      "burst_size": null,
      "inter_burst_ms": null,
      "delay_seconds": null,
      "concurrency_model": "consumer_instances",
      "requested_partitions": 16,
      "observed_partitions": 16,
      "kafka_consumer_replicas": 1,
      "kafka_consumer_instances_per_container": 4,
      "kafka_configured_consumer_instances": 4,
      "kafka_assignment_parallelism_upper_bound": 4,
      "kafka_compression": "none",
      "kafka_acks": "all"
    },
    "statistics": {
      "expected_messages": 10000,
      "accounted_messages": 10000,
      "total_messages": 10000,
      "successful": 10000,
      "logical_failures": 0,
      "exception_failures": 0,
      "failed": 0,
      "error_rate_pct": 0.0,
      "latency_ms": {
        "min": 6.49,
        "max": 4269.63,
        "mean": 2146.44,
        "median": 2143.65,
        "p95": 4055.28,
        "p99": 4228.99,
        "stddev": 1226.36
      },
      "wait_to_start_ms": {
        "min": 5.72,
        "max": 4269.27,
        "mean": 2146.1,
        "median": 2143.31,
        "p95": 4054.93,
        "p99": 4228.64,
        "stddev": 1226.37
      },
      "processing_ms": {
        "min": 0.29,
        "max": 0.77,
        "mean": 0.35,
        "median": 0.34,
        "p95": 0.36,
        "p99": 0.39
      },
      "throughput": {
        "consumed_msg_per_sec": 2317.31,
        "produce_msg_per_sec": 208658.35
      },
      "timing_s": {
        "total_wall": 4.3154,
        "produce": 0.0479,
        "drain": 4.2674
      }
    },
    "trace_file": "traces/kafka-cpu_light-20260322_165150-04eb7f90.jsonl.gz"
  },
  {
    "schema_version": "3.5.0",
    "run_id": "kafka-cpu_light-20260322_165204-01138150",
    "suite_id": "cpu_light_matched_concurrency",
    "condition_id": "concurrency=4",
    "repeat_index": 2,
    "variable_under_test": "system",
    "system": "kafka",
    "workload": "cpu_light",
    "timestamp": "2026-03-22T16:52:52.809735+00:00",
    "run_start_utc": "2026-03-22T16:52:47.742290Z",
    "run_end_utc": "2026-03-22T16:52:52.297772Z",
    "config": {
      "messages": 10000,
      "warmup": 500,
      "produce_pattern": "sequential",
      "stub_delay_ms": 0,
      "stub_capacity_workers": 20,
      "nominal_concurrency_target": 4,
      "semantics_profile": "acks=all, single-replica topic, partition-ordered consumption",
      "burst_size": null,
      "inter_burst_ms": null,
      "delay_seconds": null,
      "concurrency_model": "consumer_instances",
      "requested_partitions": 16,
      "observed_partitions": 16,
      "kafka_consumer_replicas": 1,
      "kafka_consumer_instances_per_container": 4,
      "kafka_configured_consumer_instances": 4,
      "kafka_assignment_parallelism_upper_bound": 4,
      "kafka_compression": "none",
      "kafka_acks": "all"
    },
    "statistics": {
      "expected_messages": 10000,
      "accounted_messages": 10000,
      "total_messages": 10000,
      "successful": 10000,
      "logical_failures": 0,
      "exception_failures": 0,
      "failed": 0,
      "error_rate_pct": 0.0,
      "latency_ms": {
        "min": 5.95,
        "max": 4289.12,
        "mean": 2158.14,
        "median": 2158.09,
        "p95": 4078.61,
        "p99": 4247.52,
        "stddev": 1234.01
      },
      "wait_to_start_ms": {
        "min": 5.58,
        "max": 4288.78,
        "mean": 2157.8,
        "median": 2157.75,
        "p95": 4078.27,
        "p99": 4247.18,
        "stddev": 1234.01
      },
      "processing_ms": {
        "min": 0.29,
        "max": 0.65,
        "mean": 0.35,
        "median": 0.34,
        "p95": 0.37,
        "p99": 0.39
      },
      "throughput": {
        "consumed_msg_per_sec": 2314.12,
        "produce_msg_per_sec": 292992.44
      },
      "timing_s": {
        "total_wall": 4.3213,
        "produce": 0.0341,
        "drain": 4.2872
      }
    },
    "trace_file": "traces/kafka-cpu_light-20260322_165204-01138150.jsonl.gz"
  },
  {
    "schema_version": "3.5.0",
    "run_id": "kafka-cpu_light-20260322_165254-754d0e52",
    "suite_id": "cpu_light_matched_concurrency",
    "condition_id": "concurrency=4",
    "repeat_index": 3,
    "variable_under_test": "system",
    "system": "kafka",
    "workload": "cpu_light",
    "timestamp": "2026-03-22T16:53:42.667106+00:00",
    "run_start_utc": "2026-03-22T16:53:37.598659Z",
    "run_end_utc": "2026-03-22T16:53:42.171433Z",
    "config": {
      "messages": 10000,
      "warmup": 500,
      "produce_pattern": "sequential",
      "stub_delay_ms": 0,
      "stub_capacity_workers": 20,
      "nominal_concurrency_target": 4,
      "semantics_profile": "acks=all, single-replica topic, partition-ordered consumption",
      "burst_size": null,
      "inter_burst_ms": null,
      "delay_seconds": null,
      "concurrency_model": "consumer_instances",
      "requested_partitions": 16,
      "observed_partitions": 16,
      "kafka_consumer_replicas": 1,
      "kafka_consumer_instances_per_container": 4,
      "kafka_configured_consumer_instances": 4,
      "kafka_assignment_parallelism_upper_bound": 4,
      "kafka_compression": "none",
      "kafka_acks": "all"
    },
    "statistics": {
      "expected_messages": 10000,
      "accounted_messages": 10000,
      "total_messages": 10000,
      "successful": 10000,
      "logical_failures": 0,
      "exception_failures": 0,
      "failed": 0,
      "error_rate_pct": 0.0,
      "latency_ms": {
        "min": 7.13,
        "max": 4309.57,
        "mean": 2186.15,
        "median": 2188.55,
        "p95": 4098.84,
        "p99": 4269.41,
        "stddev": 1226.84
      },
      "wait_to_start_ms": {
        "min": 6.34,
        "max": 4309.23,
        "mean": 2185.8,
        "median": 2188.21,
        "p95": 4098.5,
        "p99": 4269.06,
        "stddev": 1226.84
      },
      "processing_ms": {
        "min": 0.29,
        "max": 0.99,
        "mean": 0.35,
        "median": 0.34,
        "p95": 0.37,
        "p99": 0.41
      },
      "throughput": {
        "consumed_msg_per_sec": 2294.25,
        "produce_msg_per_sec": 185477.06
      },
      "timing_s": {
        "total_wall": 4.3587,
        "produce": 0.0539,
        "drain": 4.3048
      }
    },
    "trace_file": "traces/kafka-cpu_light-20260322_165254-754d0e52.jsonl.gz"
  }
]
