{
  "schema_version": "3.5.0",
  "run_id": "kafka-bursty_ingest-20260322_173100-03db5cfd",
  "suite_id": "bursty_ingest_shape",
  "condition_id": "produce_shape=microburst",
  "repeat_index": 3,
  "variable_under_test": "produce_shape",
  "system": "kafka",
  "workload": "bursty_ingest",
  "timestamp": "2026-03-22T17:31:47.123340+00:00",
  "run_start_utc": "2026-03-22T17:31:43.536529Z",
  "run_end_utc": "2026-03-22T17:31:46.839791Z",
  "config": {
    "messages": 5000,
    "warmup": 500,
    "produce_pattern": "microburst",
    "stub_delay_ms": 0,
    "stub_capacity_workers": 20,
    "nominal_concurrency_target": 10,
    "semantics_profile": "acks=all, single-replica topic, partition-ordered consumption",
    "burst_size": 10,
    "inter_burst_ms": 5.0,
    "delay_seconds": null,
    "concurrency_model": "consumer_instances",
    "requested_partitions": 16,
    "observed_partitions": 16,
    "kafka_consumer_replicas": 1,
    "kafka_consumer_instances_per_container": 10,
    "kafka_configured_consumer_instances": 10,
    "kafka_assignment_parallelism_upper_bound": 10,
    "kafka_compression": "none",
    "kafka_acks": "all"
  },
  "statistics": {
    "expected_messages": 5000,
    "accounted_messages": 5000,
    "total_messages": 5000,
    "successful": 5000,
    "logical_failures": 0,
    "exception_failures": 0,
    "failed": 0,
    "error_rate_pct": 0.0,
    "latency_ms": {
      "min": 0.48,
      "max": 14.87,
      "mean": 5.86,
      "median": 6.69,
      "p95": 8.66,
      "p99": 9.67,
      "stddev": 2.41
    },
    "wait_to_start_ms": {
      "min": 0.42,
      "max": 14.82,
      "mean": 5.8,
      "median": 6.63,
      "p95": 8.61,
      "p99": 9.6,
      "stddev": 2.41
    },
    "processing_ms": {
      "min": 0.04,
      "max": 0.18,
      "mean": 0.06,
      "median": 0.06,
      "p95": 0.07,
      "p99": 0.07
    },
    "throughput": {
      "consumed_msg_per_sec": 1639.4,
      "produce_msg_per_sec": 1639.89
    },
    "timing_s": {
      "total_wall": 3.0499,
      "produce": 3.049,
      "drain": 0.0009
    }
  },
  "trace_file": "traces/kafka-bursty_ingest-20260322_173100-03db5cfd.jsonl.gz",
  "resource_usage": {
    "samples": 1,
    "by_role": {
      "kafka_consumer": {
        "cpu_pct": {
          "mean": 67.43,
          "peak": 67.43
        },
        "mem_mb": {
          "mean": 36.75,
          "peak": 36.75
        }
      },
      "kafka_broker": {
        "cpu_pct": {
          "mean": 58.41,
          "peak": 58.41
        },
        "mem_mb": {
          "mean": 1171.46,
          "peak": 1171.46
        }
      }
    }
  }
}
